{
  "spec_version": "1.0",
  "bid_id": "bid_7823",
  "brand_agent_id": "brand_agent_123",
  "context_id": "ctx_92fA1",
  "wallet_id": "wallet_890",
  "targeting": {
    "intent_types": ["commercial", "transactional"],
    "decision_phases": ["consideration", "decision", "action"],
    "verticals": ["crm", "sales_software"],
    "countries": ["US"],
    "locales": ["en-US"]
  },
  "pricing": {
    "currency": "USD",
    "cpx_micros": 50000,
    "cpc_micros": 450000,
    "cpe_micros": 700000,
    "cpa_micros": 10000000,
    "preferred_pricing_model": "CPA"
  },
  "budget": {
    "max_bid_per_event_micros": 10000000,
    "daily_cap_micros": 50000000,
    "remaining_budget_micros": 32000000,
    "pacing_mode": "even"
  },
  "recommendation": {
    "creative_input": {
      "brand_name": "Nimbus",
      "product_name": "Nimbus CRM Pro",
      "short_description": "CRM built for growing teams, with AI-assisted workflows.",
      "long_description": "Nimbus CRM Pro helps five-to-fifty person teams manage pipeline, forecasting, and follow-ups with built-in AI assistance.",
      "value_props": [
        "Automated pipeline insights",
        "Collaborative forecasting",
        "AI-powered follow-up suggestions"
      ],
      "context_snippet": "For small sales teams comparing CRM tools with automation and guided setup.",
      "cta_label": "Start Free Trial",
      "cta_url": "https://nimbus.example.com/signup",
      "assets": {
        "logo_url": "https://cdn.example.com/nimbus/logo.png",
        "image_urls": ["https://cdn.example.com/nimbus/crm.png"],
        "resource_urls": ["https://nimbus.example.com/signup"]
      },
      "product_id": "prod_nimbus_001",
      "categories": ["crm", "saas"],
      "fallback_formats": ["tail", "product_card"],
      "offer_summary": "50% off for the first three months"
    }
  },
  "declared_relevance": 0.87,
  "supported_opportunities": [
    "comparison_slot",
    "decision_moment",
    "transaction_trigger"
  ],
  "preferred_format": "weave",
  "delegation": {
    "supported": true,
    "consent_required": true,
    "supported_for_intents": {
      "intent_types": ["transactional", "commercial"],
      "decision_phases": ["decision", "action", "post_purchase"]
    },
    "required_scopes": ["intent", "constraints"],
    "protocol": {
      "type": "mcp",
      "version": "1.0"
    },
    "mcp": {
      "server_url": "https://agent.nimbus.example.com/mcp",
      "tool_name": "start_crm_signup_session",
      "session_init_schema_ref": "https://agent.nimbus.example.com/schemas/session-init.json"
    },
    "session_constraints": {
      "multi_turn": true,
      "session_timeout_seconds": 900,
      "max_turns": 25
    }
  },
  "format_constraints": {
    "max_responses": 1,
    "ranking": "operator_defined"
  },
  "processing_latency_ms": 42,
  "valid_until": "2026-03-27T18:23:00Z",
  "timestamp": "2026-03-27T18:22:01Z"
}
